,question,tag,correction
0,is there a key value store,ray-core,
1,how is an generator function handled by ray internally? is the generator “enumerated” before being passed on as a ref?,ray-core,
2,in my a2c tune run (custom env) how can i make sure that use_lstm is set to true?,tune,rllib
3,"let's assume I am running simple_q, in which python file env.step() is being executed?",cluster,rllib
4,"In my custom env, hoe can I normalize the observation space?",rllib,
5,"when working with a variable length observation space, do I have to implement my own model?",rllib,
6,How can I do inference on my trained model?,other,train
7,What's the difference betwen to_arrow_refs and get_internal_block_refs?,data,
8,how to rewrite old ppo_config dict into new,rllib,
9,How do I iterate over internal block refs of a ray data set as arrow tables?,data,
10,whta do you know about ray on vertex ai,other,
11,How do I set a timeout on an actor function call,ray-core,
12,", my ray.init is stuck with the following msg : Connecting to existing Ray cluster at address: 192.168.0.143:6379... What could be wrong ?",cluster,
13,how can i force ray to reupload my runtime environment,ray-core,
14,"when I run an algo like simple_q, which python file execute env.step()",cluster,rllib
15,"ds.iter_batches fails on empty parquet files, how do i handle this",data,
16,how can I get the current runtime env dict,ray-core,
17,join node to existing cluster,cluster,
18,How do I load results from a past ray tune experiment,tune,
19,ModuleNotFoundError: No module named 'ray.rllib.utils.torch_ops' I'm getting this error with this code: from marllib import marl,rllib,
20,How do you get access to the storage_path in the trainer function ?,train,
21,what is model_id used for ?,rllib,
22,what is the model_name parameter used for ?,other,
23,我如何將固定的參數放到objectstore裡面,ray-core,
24,"2023-10-22 14:40:05,062 ERROR trial_runner.py:1088 -- Trial train_d2601_00001: Error processing event. ray.exceptions.RayTaskError(FileNotFoundError): ray::ImplicitFunc.train() (pid=916467, ip=192.168.50.157, repr=train) File ""/home/ray_cluster/anaconda3/envs/fortheray/lib/python3.8/site-packages/ray/tune/trainable/trainable.py"", line 367, in train raise skipped from exception_cause(skipped) File ""/home/ray_cluster/anaconda3/envs/fortheray/lib/python3.8/site-packages/ray/tune/trainable/function_trainable.py"", line 335, in entrypoint return self._trainable_func( File ""/home/ray_cluster/anaconda3/envs/fortheray/lib/python3.8/site-packages/ray/tune/trainable/function_trainable.py"", line 652, in _trainable_func output = fn() File ""/home/ray_cluster/anaconda3/envs/fortheray/lib/python3.8/site-packages/ray/tune/trainable/util.py"", line 394, in _inner return inner(config, checkpoint_dir=None) File ""/home/ray_cluster/anaconda3/envs/fortheray/lib/python3.8/site-packages/ray/tune/trainable/util.py"", line 386, in inner return trainable(config, **fn_kwargs) File ""train2.py"", line 95, in train FileNotFoundError: [Errno 2] No such file or directory: '/home/ray_cluster/Documents/workspace/yolov7-main/data/data.yaml' Result for train_d2601_00001: date: 2023-10-22_14-40-04 experiment_id: 01060f68bdf0480db893cdac547f7fa1 hostname: ray node_ip: 192.168.50.157 pid: 916467 timestamp: 1697956804 trial_id: d2601_00001這是甚麼錯誤",tune,
25,"in rllib experiments or in any rl experiment, when training agents on environments, whats the common practice, for instance, if i want to train a common gym environment, how should i go about it,whats the criteria of choosing algos? for example's sake lets say i chose ppo, what should be configurations, should i search for people who have already trained them, if i find them,good enough, if not, what them? is it trial and error ?",tune,
26,how to print model summary from policy object in ray rllib?,rllib,
27,get class name from actor handle,ray-core,
28,Can I train scikit learn regressors with ray?,train,
29,are p2p connections constantly maintained between worker nodes,ray-core,
30,How do I know what class an ActorHandle belongs to,ray-core,
31,are Ray nodes dynamically connected or fixed,ray-core,cluster
32,are Ray nodes interconnected,ray-core,cluster
33,Can I ask you how could I debug my code?,other,ray-core
34,eHow do I make sure Python version between client and sever are the same when I’m using conda environments on the cluster?,cluster,ray-core
35,How do I avoid the error around Python version mismatch between cluster set up and execution of a task,cluster,ray-core
36,ray.wait点用法,ray-core,
37,"I want to pass values from the info dict of my environment to my policy for training using a view requirement, but the info dict is a tensor of all zeros.",rllib,
38,"In Ray RLLib, what is the difference between local worker, rollout worker and learner worker?",rllib,
39,"can you point where the ray worker inherits the environment from ? I am getting an error for missing pip module but that should be there. Nonetheless, I added it in runtime_env and even then it does not work",ray-core,
40,what is the difference between map_batches and flat_map,data,
41,How do I check my ray[tune] version?,tune,other
42,how do I change the logging dir for ray,other,ray-observability
43,how to define a custom action distribution class?,rllib,
44,"I cant recall, is there a way to pass a single ref to a ray.remote call but to tell the receiving function to unpack it as a 2 arguments? provided we passed in a tuple",ray-core,
45,build a eks cluster,cluster,
46,"When I deploy a cluster to AWS, why when I do ray.init() it connects automatically to that cluster?",cluster,
47,I have a backend of Django and a ray cluster with multiple GPUs deployed on AWS. I have a training script in the back-end code with the decorator @ray.remote. How can I submit this to the ray cluster?,cluster,
48,what is ray dashboard port,cluster,
49,"I executed the code: import lightgbm as lgb import numpy as np import sklearn.datasets import sklearn.metrics from sklearn.model_selection import train_test_split from ray import train, tune from ray.tune.schedulers import ASHAScheduler from ray.tune.integration.lightgbm import TuneReportCheckpointCallback def train_breast_cancer(config): data, target = sklearn.datasets.load_breast_cancer(return_X_y=True) train_x, test_x, train_y, test_y = train_test_split(data, target, test_size=0.25) train_set = lgb.Dataset(train_x, label=train_y) test_set = lgb.Dataset(test_x, label=test_y) gbm = lgb.train( config, train_set, valid_sets=[test_set], valid_names=[""eval""], verbose_eval=False, callbacks=[ TuneReportCheckpointCallback( { ""binary_error"": ""eval-binary_error"", ""binary_logloss"": ""eval-binary_logloss"", } ) ], ) preds = gbm.predict(test_x) pred_labels = np.rint(preds) train.report( { ""mean_accuracy"": sklearn.metrics.accuracy_score(test_y, pred_labels), ""done"": True, } ) if __name__ == ""__main__"": config = { ""objective"": ""binary"", ""metric"": [""binary_error"", ""binary_logloss""], ""verbose"": -1, ""boosting_type"": tune.grid_search([""gbdt"", ""dart""]), ""num_leaves"": tune.randint(10, 1000), ""learning_rate"": tune.loguniform(1e-8, 1e-1), } tuner = tune.Tuner( train_breast_cancer, tune_config=tune.TuneConfig( metric=""binary_error"", mode=""min"", scheduler=ASHAScheduler(), num_samples=2, local_dir=""/content/ray_results/"" ), param_space=config, ) results = tuner.fit() print(""Best hyperparameters found were: "", results.get_best_result().config) and I got the error: RuntimeError Traceback (most recent call last) <ipython-input-53-6c8994e77284> in <cell line: 43>() 63 results = tuner.fit() 64 ---> 65 print(""Best hyperparameters found were: "", results.get_best_result().config) /usr/local/lib/python3.10/dist-packages/ray/tune/result_grid.py in get_best_result(self, metric, mode, scope, filter_nan_and_inf) 163 else ""."" 164 ) --> 165 raise RuntimeError(error_msg) 166 167 return self._trial_to_result(best_trial) RuntimeError: No best trial found for the given metric: binary_error. This means that no trial has reported this metric, or all values reported for this metric are NaN. To not ignore NaN values, you can set the `filter_nan_and_inf` arg to False.",tune,
50,"I executed the following code: import lightgbm as lgb import numpy as np import sklearn.datasets import sklearn.metrics from sklearn.model_selection import train_test_split from ray import train, tune from ray.tune.schedulers import ASHAScheduler from ray.tune.integration.lightgbm import TuneReportCheckpointCallback def train_breast_cancer(config): data, target = sklearn.datasets.load_breast_cancer(return_X_y=True) train_x, test_x, train_y, test_y = train_test_split(data, target, test_size=0.25) train_set = lgb.Dataset(train_x, label=train_y) test_set = lgb.Dataset(test_x, label=test_y) gbm = lgb.train( config, train_set, valid_sets=[test_set], valid_names=[""eval""], verbose_eval=False, callbacks=[ TuneReportCheckpointCallback( { ""binary_error"": ""eval-binary_error"", ""binary_logloss"": ""eval-binary_logloss"", } ) ], ) preds = gbm.predict(test_x) pred_labels = np.rint(preds) train.report( { ""mean_accuracy"": sklearn.metrics.accuracy_score(test_y, pred_labels), ""done"": True, } ) if __name__ == ""__main__"": config = { ""objective"": ""binary"", ""metric"": [""binary_error"", ""binary_logloss""], ""verbose"": -1, ""boosting_type"": tune.grid_search([""gbdt"", ""dart""]), ""num_leaves"": tune.randint(10, 1000), ""learning_rate"": tune.loguniform(1e-8, 1e-1), } tuner = tune.Tuner( train_breast_cancer, tune_config=tune.TuneConfig( metric=""binary_error"", mode=""min"", scheduler=ASHAScheduler(), num_samples=2, ), param_space=config, ) results = tuner.fit() print(""Best hyperparameters found were: "", results.get_best_result().config) and the got the folllowing error message: ValueError Traceback (most recent call last) <ipython-input-45-6c8994e77284> in <cell line: 43>() 61 param_space=config, 62 ) ---> 63 results = tuner.fit() 64 65 print(""Best hyperparameters found were: "", results.get_best_result().config) 4 frames /usr/local/lib/python3.10/dist-packages/ray/tune/analysis/experiment_analysis.py in __init__(self, experiment_checkpoint_path, storage_filesystem, trials, default_metric, default_mode) 123 if experiment_json_filename is None: 124 pattern = TuneController.CKPT_FILE_TMPL.format(""*"") --> 125 raise ValueError( 126 f""No experiment checkpoint file of form '{pattern}' was found at: "" 127 f""({self._fs.type_name}, {self._experiment_fs_path})\n"" ValueError: No experiment checkpoint file of form 'experiment_state-*.json' was found at: (local, /root/ray_results/train_breast_cancer_2023-10-21_17-29-56) Please check if you specified the correct experiment path, which should be a combination of the `storage_path` and `name` specified in your run. How to fix the error. The code is from your tutorial",tune,
51,Does TorchTrainer take a TrialInfo ?,train,
52,how to tune lightgbm,tune,
53,should I install ray in virtual machine or in kuberenetes with kuberay operator?,cluster,
54,suppose i had 10 tasks in remote and ray outputs 1 task killed due to OOM pressure .DOes ray retry the task later ?,ray-core,
55,what about ray on vertex ai?,other,
56,usecases of ray,ray-core,other
57,What is Ray,ray-core,
58,actor函数优先级,ray-core,
59,Does Ray have a distributed file system,ray-core,
60,is min and max worker port inclusive?,rllib,ray-core
61,can ray do cross-cluster operation,cluster,
62,"I have many worker node group, how do I schedule actor into specific node group?",ray-core,
63,Does Ray increment a run number after every run to not overwrite data.,data,other
64,What about Hugging Fact Dataset Cache Dir?,data,
65,* If I deploy an application using serve.run inside an already running serve client (for example by calling it on an application that was deployed during startup) would this new application be recovered when GCS fault tolerance is enabled and the ServeController crashes?*,serve,
66,Why would I want to use RAY,cluster,other
67,Can Ray be configured to store everything to S3 ?,cluster,ray-core
68,prevent schedule worker actor on head node,ray-core,
69,What is an example of an FSDP Scaling config ?,train,
70,can i change FUNCTION_SIZE_ERROR_THRESHOLD,ray-core,
71,Can Ray train on TPUs ?,train,
72,what does TorchTrainer do ?,train,
73,Can I download the whole docs as pdf or offline version?,other,
74,do i setup gpus in advance,cluster,
75,how can I scale a serve deployment programmatically with its handle,serve,
76,How to make my torch trainer make use of Apple silicon(mps) for training instead of cpu,other,train
77,How to make my torch trainer make use of Apple silicon(mps) for training instead of cpu,other,train
78,do i need to have multiple machines to try ray,ray-core,
79,"explain""Doubling the CPU requirements, runs only half(7) of the Tasks at the same time, and memory usage doesn’t exceed 9GB.""",ray-core,
80,where is the log which is output into the console?,tune,ray-observability
81,How do I give an actor custom resources,ray-core,
82,"whats the use for ""truncated"" in ""step"" procedure of an custom env for RLLib?",rllib,
83,"I'm starting the Ray cluster with `ray start --block`. I'd also like to run `serve start`, but only after the cluster has been started. My issue is that I need to run `ray start` first, and I need it to block. This doesn't give me an opportunity to run `serve start` after the cluster has been started",cluster,
84,how to use resume_from_checkpoint,train,
85,Why should I use map_batches as opposed to map for ray data?,data,
86,How to save and reload checkpoint with ray rllib python api?,rllib,
87,how to save and reload checkpoint with ray?,tune,train
88,"running your code I got the following error message: TuneError Traceback (most recent call last) <ipython-input-83-873af01b7718> in <cell line: 30>() 28 29 # Run the hyperparameter tuning ---> 30 analysis = tune.run(train_model, config=config) 31 32 # Get the best hyperparameters /usr/local/lib/python3.10/dist-packages/ray/tune/tune.py in run(run_or_experiment, name, metric, mode, stop, time_budget_s, config, resources_per_trial, num_samples, storage_path, storage_filesystem, search_alg, scheduler, checkpoint_config, verbose, progress_reporter, log_to_file, trial_name_creator, trial_dirname_creator, sync_config, export_formats, max_failures, fail_fast, restore, server_port, resume, reuse_actors, raise_on_failed_trial, callbacks, max_concurrent_trials, keep_checkpoints_num, checkpoint_score_attr, checkpoint_freq, checkpoint_at_end, chdir_to_trial_dir, local_dir, _experiment_checkpoint_dir, _remote, _remote_string_queue, _entrypoint) 1135 if incomplete_trials: 1136 if raise_on_failed_trial and not experiment_interrupted_event.is_set(): -> 1137 raise TuneError(""Trials did not complete"", incomplete_trials) 1138 else: 1139 logger.error(""Trials did not complete: %s"", incomplete_trials) TuneError: ('Trials did not complete', [train_model_d3692_00000])",tune,
89,"I run : tuner = tune.Tuner( train_breast_cancer, tune_config=tune.TuneConfig( # metric=""binary_error"", # mode=""min"", scheduler=ASHAScheduler( metric=""binary_error"",mode=""min""), num_samples=2, ), param_space=config, ) results = tuner.fit() print(""Best hyperparameters found were: "", results.get_best_result( ).config) then I got the following error and warning: 2023-10-20 22:48:54,109 WARNING experiment_analysis.py:596 -- Could not find best trial. Did you pass the correct `metric` parameter? --------------------------------------------------------------------------- RuntimeError Traceback (most recent call last) <ipython-input-79-e979625bdedf> in <cell line: 1>() ----> 1 print(""Best hyperparameters found were: "", results.get_best_result( metric=""binary_error"",mode=""min"").config) /usr/local/lib/python3.10/dist-packages/ray/tune/result_grid.py in get_best_result(self, metric, mode, scope, filter_nan_and_inf) 163 else ""."" 164 ) --> 165 raise RuntimeError(error_msg) 166 167 return self._trial_to_result(best_trial) RuntimeError: No best trial found for the given metric: binary_error. This means that no trial has reported this metric, or all values reported for this metric are NaN. To not ignore NaN values, you can set the `filter_nan_and_inf` arg to False.",tune,
90,what API should I call Ray to get cluster info,cluster,ray-observability
91,"I run tuner = tune.Tuner( train_breast_cancer, tune_config=tune.TuneConfig( # metric=""binary_error"", # mode=""min"", scheduler=ASHAScheduler( metric=""binary_error"",mode=""min""), num_samples=2, ), param_space=config, )",tune,
92,provide example of tuning lightgbm,train,tune
93,How can I check if an ActorState is DEAD in python api,ray-observability,
94,How do I do it in python api,other,
95,How do I check if an ActorState is DEAD,ray-core,ray-observability
96,"I am trying to run : Contents Example Using LightGBM with Tune LightGBM Logo Example Example import lightgbm as lgb import numpy as np import sklearn.datasets import sklearn.metrics from sklearn.model_selection import train_test_split from ray import train, tune from ray.tune.schedulers import ASHAScheduler from ray.tune.integration.lightgbm import TuneReportCheckpointCallback def train_breast_cancer(config): data, target = sklearn.datasets.load_breast_cancer(return_X_y=True) train_x, test_x, train_y, test_y = train_test_split(data, target, test_size=0.25) train_set = lgb.Dataset(train_x, label=train_y) test_set = lgb.Dataset(test_x, label=test_y) gbm = lgb.train( config, train_set, valid_sets=[test_set], valid_names=[""eval""], verbose_eval=False, callbacks=[ TuneReportCheckpointCallback( { ""binary_error"": ""eval-binary_error"", ""binary_logloss"": ""eval-binary_logloss"", } ) ], ) preds = gbm.predict(test_x) pred_labels = np.rint(preds) train.report( { ""mean_accuracy"": sklearn.metrics.accuracy_score(test_y, pred_labels), ""done"": True, } ) if __name__ == ""__main__"": config = { ""objective"": ""binary"", ""metric"": [""binary_error"", ""binary_logloss""], ""verbose"": -1, ""boosting_type"": tune.grid_search([""gbdt"", ""dart""]), ""num_leaves"": tune.randint(10, 1000), ""learning_rate"": tune.loguniform(1e-8, 1e-1), } tuner = tune.Tuner( train_breast_cancer, tune_config=tune.TuneConfig( metric=""binary_error"", mode=""min"", scheduler=ASHAScheduler(), num_samples=2, ), param_space=config, ) results = tuner.fit() print(""Best hyperparameters found were: "", results.get_best_result().config) and I am getting the following error: ValueError Traceback (most recent call last) <ipython-input-64-fa1c673ad5fe> in <cell line: 1>() ----> 1 results = tuner.fit() 2 8 frames /usr/local/lib/python3.10/dist-packages/ray/tune/schedulers/async_hyperband.py in on_trial_add(self, tune_controller, trial) 123 def on_trial_add(self, tune_controller: ""TuneController"", trial: Trial): 124 if not self._metric or not self._metric_op: --> 125 raise ValueError( 126 ""{} has been instantiated without a valid `metric` ({}) or "" 127 ""`mode` ({}) parameter. Either pass these parameters when "" ValueError: AsyncHyperBandScheduler has been instantiated without a valid `metric` (None) or `mode` (None) parameter. Either pass these parameters when instantiating the scheduler, or pass them as parameters to `tune.TuneConfig()` : How to fix the problem ?",tune,
97,Exception: Cannot include dashboard with missing packages.,cluster,ray-observability
98,how does ray behave when a function returns a tuple?,ray-core,
99,How can I get a named actor by id,ray-core,
100,get a list of all named actors in a namespace,ray-core,
101,i have ray implemented in cpp code.How can i compile iot ?,rllib,ray-core
102,can you write the entire coce including what to write or #include ?,data,ray-core
103,how do I call the healthz endpoint using grpcurl?,serve,
104,I want to use ray cpp to parallelize a function in c++ code .Can you guide me give me a example,ray-core,
105,how do i release the actors created by ray data transformations?,data,
106,is there a way to set the max block size when using ray dataset / map_batches,data,
107,force clea-up idle nodes,cluster,
108,I'm getting a AttributeError: 'Dataset' object has no attribute 'unique' error when trying to run Dataset.unique. What could be the reason?,data,
109,How to deploy Ray Serve on a cluster?,serve,
110,how to deploy it on a cluster?,cluster,
111,the autoscaler failed with signal 15,cluster,
112,"I am deploying my application using: serve.run(_target_ = application, _name_=deployment_name, _route_prefix_=prefix) How can i programmatically make a request to the prefix endpoint through serve ?",serve,
113,Show me an example of optuna with ASHA scheduler with ray tune,tune,
114,checkpoint_path: /tmp/tmpqkrkahqo/checkpoint.pth,tune,train
115,Repartition thousands of files,data,
116,how do i stream in a set of files?,rllib,data
117,Checkpoint.from_directory() how does this code works,train,
118,ray tune isnt reporting the output to the output file on a PBSpro cluster,tune,
119,"best_checkpoint = best_trial.checkpoint.to_air_checkpoint() best_checkpoint_data = best_checkpoint.to_dict() best_trained_model.load_state_dict(best_checkpoint_data[""net_state_dict""])is there anything wrong with this code?",tune,
120,How do i view model summary from PPOTF1Policy,rllib,
121,how do i stream data?,data,
122,how do i read data from an iterator?,data,
123,ray.air.Checkpoint` is deprecated. Please use `ray.train.Checkpoint` instead.,train,
124,how do i create a datasource from a stream?,data,
125,how do i index into a ray dataset?,data,
126,can i have nested parallel ray jobs? for example a ray.remote function calls ray.get on another list of ray tasks?,ray-core,
127,how do i iterate over the product of files in ray data?,data,
128,how to continue training when I had previously stopped it,rllib,train
129,"session.report( {""loss"": val_loss / val_steps, ""accuracy"": correct / total, ""checkpoint"": checkpoint}, )how can I get the checkpoint data if I save the weight in this way",train,
130,is there a way to flag the system to ignore any num_cpus def when in local mode?,ray-core,
131,how do i pass an argument to actor when calling .map?,ray-core,data
132,What is Ray?,ray-core,
133,map_batches restrict to one actor per gpu,ray-core,data
134,What is the new ray handle being introduced after 2.7.1,ray-core,serve
135,What is the new ray handle being introduced after 2.7.1,ray-core,serve
136,how to find why ray.init times out?,ray-core,
137,Which advanced exploration technics for RL are available in ray?,rllib,
138,can two people ray.init to the same ray cluster?,cluster,
139,"for dqn what are the possible configs for type replay_buffer_config.update({ ""type""",rllib,
140,how to log debug level in cutom log file,ray-observability,
141,"When using persistent cloud storage, do the worker nodes save to the cloud by first sending data to the head node?",cluster,other
142,iter_torch_batches,rllib,data
143,how should I use trial name creator.,tune,
144,set conda env to serve deployment,serve,
145,can i find out from logs what was the ip address of the machine that called ray.init ?,cluster,ray-core
146,how to place a serve deployments to a specific node,serve,
147,for a single trial how do I plot the loss for each epoch,ray-core,train
148,how does manual inference using compute_single_action with view requirements and the trajectory api?,rllib,
149,What is teh best way to overcome the credit assignment problem when training with PPO?,other,rllib
150,"Logical resource usage: 1.0/24 CPUs, 0/3 GPUs (0.0/1.0 accelerator_type:G) is this as fast as possible",ray-core,
151,I get the following error when trying to analyse my 'ExperimentAnalysis' results object: TypeError: 'ExperimentAnalysis' object is not iterable,tune,
152,assign a actor to specific node,ray-core,
153,"when i using compute_single_action with a model with complicated view requirements (trajectory api), including states and requirements regarding obs, rewards and action of multiple last episodes do i need to process these in any way, for example concatenate it, or is this already managed in compute_single_action itself?",rllib,
154,"After finishing a tune.tuner experiment, there is no tuner.pkl file in my experiment directory, what is wrong?",tune,
155,how do i use callbacks function to access infos data?,data,
156,how to use ApexTrainer?,train,
157,how to kill and restart workers if their memory usage is too large ?,ray-core,
158,how do i get the number of workers in an algorithm?,rllib,
159,I have an actor pool that contains a function called count and I want to process a list of number thorugh this function,ray-core,
160,"can you outline to me the difference between partition, paralellism, block (batch?) size, in the context of a using ray dataset",data,
161,"for this provided ray RLLib example, how can i set ""store_infos"" : True? from ray.rllib.examples.env.two_step_game import TwoStepGame from ray.rllib.algorithms.qmix import QMixConfig config = QMixConfig() config = config.training(gamma=0.9, lr=0.01, kl_coeff=0.3) config = config.resources(num_gpus=0) config = config.rollouts(num_rollout_workers=4) print(config.to_dict()) # Build an Algorithm object from the config and run 1 training iteration. algo = config.build(env=TwoStepGame) algo.train()",rllib,
162,"ow can i set ""store_infos"" : True, for an custom environment RLLib python API?",rllib,
163,Is it possible for me to write outputs to Google Cloud Storage so that those outputs never reside on the nodes of my cluster?,cluster,
164,Could you give an example of actorpool?,ray-core,
